<?xml version="1.0" encoding="UTF-8"?>

<!ELEMENT matricula (ciclo, alumnado)>
<!ELEMENT ciclo (#PCDATA)>
<!ELEMENT alumnado (alumno)>
<!ELEMENT alumno (nombre,anyo,modulos)>
<!ELEMENT nombre (#PCDATA)>
<!ELEMENT anyo (#PCDATA)>
<!ELEMENT modulos (modulo+)>
<!ELEMENT modulo (#PCDATA)>

